{
  "eventId": "11111111-1111-4111-8111-111111111111",
  "eventType": "auth.user.registered.v1",
  "version": 1,
  "occurredAt": "2026-05-10T12:00:00Z",
  "correlationId": "auth-registration-123",
  "payload": {
    "userId": "22222222-2222-4222-8222-222222222222",
    "email": "john@example.com"
  }
}
